{
  "allowed_opcodes": [
    "C",
    "R",
    "I",
    "L",
    "W",
    "E",
    "S",
    "F"
  ],
  "arm": "source",
  "base_opcodes": [
    "C",
    "R",
    "I",
    "L",
    "W",
    "E",
    "S",
    "F"
  ],
  "current_turn": 5,
  "forbidden_opcodes": [],
  "phase": "work",
  "remaining_mutation_attempts": 3,
  "remaining_public_evaluations": 2,
  "request_mask_required": false,
  "reserved_terminal_turns": 1,
  "schema_version": "ai-experiments.semantic-ir.session-progress-contract/v1",
  "terminal_reserve_active": false,
  "total_turns": 12,
  "transition_reason": "budget_open",
  "turns_remaining_including_current": 8
}
